{
  "confidence": "HIGH",
  "registrant": {
    "entity_type": "company",
    "entity_properties": {
      "alternative_names": [
        {
          "company_name": "CHUCK E. CHEESE'S",
          "type": "trading"
        }
      ],
      "jurisdiction_code": "us_ny",
      "name": "CEC ENTERTAINMENT, INC.",
      "telephone_number": "(972) 258-5807",
      "identifiers": [
        {
          "uid": "12345",
          "identifier_system_code": "us_rssd"
        }
      ]
    }
  },
  "register": {
    "jurisdiction": "United States",
    "name": "FDIC Institution Directory",
    "identifier_code_system": "us_fdic",
    "managing_organisation": {
      "name": "US Federal Deposit Insurance Corporation",
      "jurisdiction": "us",
      "website": "http://www2.fdic.gov"
    }

  },
  "register_uid": "1141789",
  "register_entry_url": "http://www2.fdic.gov/idasp/confirmation.asp?inCert1=1141789",
  "other_attributes": {
    "address_location": "1 FL",
    "borough": "Bronx"
  },
  "sample_date": "2014-12-09",
  "source_url": "http://www2.fdic.gov/idasp/"
}