{
  "confidence": "HIGH",
  "registrant": {
    "entity_type": "company",
    "entity_properties": {
      "alternative_names": [
        {
          "company_name": "CHUCK E. CHEESE'S",
          "type": "trading"
        }
      ],
      "jurisdiction_code": "us_ny",
      "name": "CEC ENTERTAINMENT, INC.",
      "telephone_number": "(972) 258-5807"
    }
  },
  "register": {
    "jurisdiction": "New York City",
    "name": "New York City Department of Consumer Affairs"
  },
  "register_uid": "1141789",
  "other_attributes": {
    "address_location": "1 FL",
    "borough": "Bronx"
  },
  "permissions": [
    {
      "activity_name": "Amusement Arcade",
      "permission_type": "operating"
    }
  ],
  "sample_date": "2014-12-09",
  "source_url": "https://data.cityofnewyork.us/Business/foo_bar"
}